tests/python/nightly/quantization/andrew_logs/nvidia.resnet18_v1.i8.i16.greedy.log.tmp
{"input": ["cuda -keys=cuda,gpu -max_num_threads=1024 -thread_warp_size=32", "conv2d_NCHWc_int8.cuda", [["TENSOR", [1, 256, 14, 14], "int8"], ["TENSOR", [512, 256, 3, 3], "int8"], [2, 2], [1, 1, 1, 1], [1, 1], "NCHW", "int32"], {}], "config": {"index": 7627200, "code_hash": null, "entity": [["tile_n", "sp", [-1, 1, 1, 1]], ["tile_f", "sp", [-1, 1, 1, 1]], ["tile_y", "sp", [-1, 1, 1, 1]], ["tile_x", "sp", [-1, 1, 7, 1]], ["fuse_yx", "ot", 0], ["tile_rc", "sp", [-1, 32]], ["tile_ry", "sp", [-1, 3]], ["tile_rx", "sp", [-1, 3]], ["reorder_inner", "re", [2, 0, 1]], ["AA_double_buffer", "ot", 1], ["WW_double_buffer", "ot", 1], ["auto_unroll_max_step", "ot", 1500]]}, "result": [[0.0017345438252427184], 0, 8.58734393119812, 1615490488.5844076], "version": 0.2, "tvm_version": "0.7.dev1"}
{"input": ["cuda -keys=cuda,gpu -max_num_threads=1024 -thread_warp_size=32", "conv2d_NCHWc_int8.cuda", [["TENSOR", [1, 256, 14, 14], "int8"], ["TENSOR", [512, 256, 3, 3], "int8"], [2, 2], [1, 1, 1, 1], [1, 1], "NCHW", "int32"], {}], "config": {"index": 166181, "code_hash": null, "entity": [["tile_n", "sp", [-1, 1, 1, 1]], ["tile_f", "sp", [-1, 2, 1, 16]], ["tile_y", "sp", [-1, 1, 1, 1]], ["tile_x", "sp", [-1, 1, 7, 1]], ["fuse_yx", "ot", 0], ["tile_rc", "sp", [-1, 2]], ["tile_ry", "sp", [-1, 1]], ["tile_rx", "sp", [-1, 3]], ["reorder_inner", "re", [0, 2, 1]], ["AA_double_buffer", "ot", 0], ["WW_double_buffer", "ot", 0], ["auto_unroll_max_step", "ot", 0]]}, "result": [[0.0007868654170403587], 0, 2.0168488025665283, 1615490492.0065172], "version": 0.2, "tvm_version": "0.7.dev1"}
{"input": ["cuda -keys=cuda,gpu -max_num_threads=1024 -thread_warp_size=32", "conv2d_NCHWc_int8.cuda", [["TENSOR", [1, 256, 14, 14], "int8"], ["TENSOR", [512, 256, 3, 3], "int8"], [2, 2], [1, 1, 1, 1], [1, 1], "NCHW", "int32"], {}], "config": {"index": 4197651, "code_hash": null, "entity": [["tile_n", "sp", [-1, 1, 1, 1]], ["tile_f", "sp", [-1, 4, 4, 2]], ["tile_y", "sp", [-1, 1, 1, 1]], ["tile_x", "sp", [-1, 7, 1, 1]], ["fuse_yx", "ot", 0], ["tile_rc", "sp", [-1, 2]], ["tile_ry", "sp", [-1, 1]], ["tile_rx", "sp", [-1, 1]], ["reorder_inner", "re", [1, 2, 0]], ["AA_double_buffer", "ot", 0], ["WW_double_buffer", "ot", 1], ["auto_unroll_max_step", "ot", 512]]}, "result": [[0.0009341856265060242], 0, 5.971236228942871, 1615490505.997652], "version": 0.2, "tvm_version": "0.7.dev1"}
{"input": ["cuda -keys=cuda,gpu -max_num_threads=1024 -thread_warp_size=32", "conv2d_NCHWc_int8.cuda", [["TENSOR", [1, 256, 14, 14], "int8"], ["TENSOR", [512, 256, 3, 3], "int8"], [2, 2], [1, 1, 1, 1], [1, 1], "NCHW", "int32"], {}], "config": {"index": 1860985, "code_hash": null, "entity": [["tile_n", "sp", [-1, 1, 1, 1]], ["tile_f", "sp", [-1, 16, 8, 1]], ["tile_y", "sp", [-1, 1, 1, 1]], ["tile_x", "sp", [-1, 7, 1, 1]], ["fuse_yx", "ot", 1], ["tile_rc", "sp", [-1, 2]], ["tile_ry", "sp", [-1, 3]], ["tile_rx", "sp", [-1, 1]], ["reorder_inner", "re", [2, 1, 0]], ["AA_double_buffer", "ot", 0], ["WW_double_buffer", "ot", 1], ["auto_unroll_max_step", "ot", 0]]}, "result": [[0.0363611229], 0, 4.522745132446289, 1615490509.5683167], "version": 0.2, "tvm_version": "0.7.dev1"}
{"input": ["cuda -keys=cuda,gpu -max_num_threads=1024 -thread_warp_size=32", "conv2d_NCHWc_int8.cuda", [["TENSOR", [1, 256, 14, 14], "int8"], ["TENSOR", [512, 256, 3, 3], "int8"], [2, 2], [1, 1, 1, 1], [1, 1], "NCHW", "int32"], {}], "config": {"index": 5663781, "code_hash": null, "entity": [["tile_n", "sp", [-1, 1, 1, 1]], ["tile_f", "sp", [-1, 1, 8, 1]], ["tile_y", "sp", [-1, 1, 7, 1]], ["tile_x", "sp", [-1, 1, 1, 7]], ["fuse_yx", "ot", 1], ["tile_rc", "sp", [-1, 16]], ["tile_ry", "sp", [-1, 1]], ["tile_rx", "sp", [-1, 3]], ["reorder_inner", "re", [2, 0, 1]], ["AA_double_buffer", "ot", 0], ["WW_double_buffer", "ot", 0], ["auto_unroll_max_step", "ot", 1500]]}, "result": [[0.000539309293986637], 0, 4.99618124961853, 1615490511.8096006], "version": 0.2, "tvm_version": "0.7.dev1"}
{"input": ["cuda -keys=cuda,gpu -max_num_threads=1024 -thread_warp_size=32", "conv2d_NCHWc_int8.cuda", [["TENSOR", [1, 256, 14, 14], "int8"], ["TENSOR", [512, 256, 3, 3], "int8"], [2, 2], [1, 1, 1, 1], [1, 1], "NCHW", "int32"], {}], "config": {"index": 2290850, "code_hash": null, "entity": [["tile_n", "sp", [-1, 1, 1, 1]], ["tile_f", "sp", [-1, 2, 4, 2]], ["tile_y", "sp", [-1, 1, 7, 1]], ["tile_x", "sp", [-1, 1, 1, 1]], ["fuse_yx", "ot", 1], ["tile_rc", "sp", [-1, 2]], ["tile_ry", "sp", [-1, 3]], ["tile_rx", "sp", [-1, 1]], ["reorder_inner", "re", [1, 2, 0]], ["AA_double_buffer", "ot", 1], ["WW_double_buffer", "ot", 1], ["auto_unroll_max_step", "ot", 0]]}, "result": [[0.0003449276850574713], 0, 1.6642146110534668, 1615490513.672542], "version": 0.2, "tvm_version": "0.7.dev1"}
{"input": ["cuda -keys=cuda,gpu -max_num_threads=1024 -thread_warp_size=32", "conv2d_NCHWc_int8.cuda", [["TENSOR", [1, 256, 14, 14], "int8"], ["TENSOR", [512, 256, 3, 3], "int8"], [2, 2], [1, 1, 1, 1], [1, 1], "NCHW", "int32"], {}], "config": {"index": 1439651, "code_hash": null, "entity": [["tile_n", "sp", [-1, 1, 1, 1]], ["tile_f", "sp", [-1, 8, 2, 1]], ["tile_y", "sp", [-1, 7, 1, 1]], ["tile_x", "sp", [-1, 1, 1, 7]], ["fuse_yx", "ot", 1], ["tile_rc", "sp", [-1, 8]], ["tile_ry", "sp", [-1, 3]], ["tile_rx", "sp", [-1, 1]], ["reorder_inner", "re", [0, 2, 1]], ["AA_double_buffer", "ot", 0], ["WW_double_buffer", "ot", 1], ["auto_unroll_max_step", "ot", 0]]}, "result": [[0.01861799805], 0, 3.7466835975646973, 1615490532.9386795], "version": 0.2, "tvm_version": "0.7.dev1"}
{"input": ["cuda -keys=cuda,gpu -max_num_threads=1024 -thread_warp_size=32", "conv2d_NCHWc_int8.cuda", [["TENSOR", [1, 256, 14, 14], "int8"], ["TENSOR", [512, 256, 3, 3], "int8"], [2, 2], [1, 1, 1, 1], [1, 1], "NCHW", "int32"], {}], "config": {"index": 1114673, "code_hash": null, "entity": [["tile_n", "sp", [-1, 1, 1, 1]], ["tile_f", "sp", [-1, 1, 2, 32]], ["tile_y", "sp", [-1, 1, 1, 1]], ["tile_x", "sp", [-1, 1, 7, 1]], ["fuse_yx", "ot", 0], ["tile_rc", "sp", [-1, 8]], ["tile_ry", "sp", [-1, 3]], ["tile_rx", "sp", [-1, 1]], ["reorder_inner", "re", [2, 0, 1]], ["AA_double_buffer", "ot", 1], ["WW_double_buffer", "ot", 0], ["auto_unroll_max_step", "ot", 0]]}, "result": [[0.0025066614666666666], 0, 1.820505142211914, 1615490534.4206836], "version": 0.2, "tvm_version": "0.7.dev1"}
{"input": ["cuda -keys=cuda,gpu -max_num_threads=1024 -thread_warp_size=32", "conv2d_NCHWc_int8.cuda", [["TENSOR", [1, 256, 14, 14], "int8"], ["TENSOR", [512, 256, 3, 3], "int8"], [2, 2], [1, 1, 1, 1], [1, 1], "NCHW", "int32"], {}], "config": {"index": 391970, "code_hash": null, "entity": [["tile_n", "sp", [-1, 1, 1, 1]], ["tile_f", "sp", [-1, 2, 4, 2]], ["tile_y", "sp", [-1, 1, 7, 1]], ["tile_x", "sp", [-1, 1, 1, 1]], ["fuse_yx", "ot", 0], ["tile_rc", "sp", [-1, 16]], ["tile_ry", "sp", [-1, 1]], ["tile_rx", "sp", [-1, 3]], ["reorder_inner", "re", [1, 2, 0]], ["AA_double_buffer", "ot", 0], ["WW_double_buffer", "ot", 0], ["auto_unroll_max_step", "ot", 0]]}, "result": [[0.0003755864635658915], 0, 2.310034990310669, 1615490536.1753778], "version": 0.2, "tvm_version": "0.7.dev1"}
{"input": ["cuda -keys=cuda,gpu -max_num_threads=1024 -thread_warp_size=32", "conv2d_NCHWc_int8.cuda", [["TENSOR", [1, 256, 14, 14], "int8"], ["TENSOR", [512, 256, 3, 3], "int8"], [2, 2], [1, 1, 1, 1], [1, 1], "NCHW", "int32"], {}], "config": {"index": 3451940, "code_hash": null, "entity": [["tile_n", "sp", [-1, 1, 1, 1]], ["tile_f", "sp", [-1, 32, 4, 1]], ["tile_y", "sp", [-1, 1, 7, 1]], ["tile_x", "sp", [-1, 1, 1, 7]], ["fuse_yx", "ot", 1], ["tile_rc", "sp", [-1, 4]], ["tile_ry", "sp", [-1, 1]], ["tile_rx", "sp", [-1, 1]], ["reorder_inner", "re", [1, 0, 2]], ["AA_double_buffer", "ot", 1], ["WW_double_buffer", "ot", 0], ["auto_unroll_max_step", "ot", 512]]}, "result": [[0.0230731783], 0, 6.168745756149292, 1615490539.1158123], "version": 0.2, "tvm_version": "0.7.dev1"}
{"input": ["cuda -keys=cuda,gpu -max_num_threads=1024 -thread_warp_size=32", "conv2d_NCHWc_int8.cuda", [["TENSOR", [1, 256, 14, 14], "int8"], ["TENSOR", [512, 256, 3, 3], "int8"], [2, 2], [1, 1, 1, 1], [1, 1], "NCHW", "int32"], {}], "config": {"index": 5655144, "code_hash": null, "entity": [["tile_n", "sp", [-1, 1, 1, 1]], ["tile_f", "sp", [-1, 8, 8, 1]], ["tile_y", "sp", [-1, 1, 7, 1]], ["tile_x", "sp", [-1, 7, 1, 1]], ["fuse_yx", "ot", 1], ["tile_rc", "sp", [-1, 4]], ["tile_ry", "sp", [-1, 1]], ["tile_rx", "sp", [-1, 3]], ["reorder_inner", "re", [2, 0, 1]], ["AA_double_buffer", "ot", 0], ["WW_double_buffer", "ot", 0], ["auto_unroll_max_step", "ot", 1500]]}, "result": [[0.0016965824382022471], 0, 3.5715954303741455, 1615490540.6436667], "version": 0.2, "tvm_version": "0.7.dev1"}
{"input": ["cuda -keys=cuda,gpu -max_num_threads=1024 -thread_warp_size=32", "conv2d_NCHWc_int8.cuda", [["TENSOR", [1, 256, 14, 14], "int8"], ["TENSOR", [512, 256, 3, 3], "int8"], [2, 2], [1, 1, 1, 1], [1, 1], "NCHW", "int32"], {}], "config": {"index": 5564536, "code_hash": null, "entity": [["tile_n", "sp", [-1, 1, 1, 1]], ["tile_f", "sp", [-1, 2, 4, 1]], ["tile_y", "sp", [-1, 1, 1, 7]], ["tile_x", "sp", [-1, 1, 1, 1]], ["fuse_yx", "ot", 0], ["tile_rc", "sp", [-1, 1]], ["tile_ry", "sp", [-1, 3]], ["tile_rx", "sp", [-1, 3]], ["reorder_inner", "re", [1, 2, 0]], ["AA_double_buffer", "ot", 0], ["WW_double_buffer", "ot", 0], ["auto_unroll_max_step", "ot", 1500]]}, "result": [[0.00024988329514963884], 0, 2.8906378746032715, 1615490542.7371655], "version": 0.2, "tvm_version": "0.7.dev1"}
{"input": ["cuda -keys=cuda,gpu -max_num_threads=1024 -thread_warp_size=32", "conv2d_NCHWc_int8.cuda", [["TENSOR", [1, 256, 14, 14], "int8"], ["TENSOR", [512, 256, 3, 3], "int8"], [2, 2], [1, 1, 1, 1], [1, 1], "NCHW", "int32"], {}], "config": {"index": 1454911, "code_hash": null, "entity": [["tile_n", "sp", [-1, 1, 1, 1]], ["tile_f", "sp", [-1, 2, 32, 1]], ["tile_y", "sp", [-1, 1, 1, 1]], ["tile_x", "sp", [-1, 1, 1, 7]], ["fuse_yx", "ot", 1], ["tile_rc", "sp", [-1, 1]], ["tile_ry", "sp", [-1, 1]], ["tile_rx", "sp", [-1, 3]], ["reorder_inner", "re", [0, 2, 1]], ["AA_double_buffer", "ot", 0], ["WW_double_buffer", "ot", 1], ["auto_unroll_max_step", "ot", 0]]}, "result": [[0.00020571140016992353], 0, 2.1991641521453857, 1615490544.2509968], "version": 0.2, "tvm_version": "0.7.dev1"}
{"input": ["cuda -keys=cuda,gpu -max_num_threads=1024 -thread_warp_size=32", "conv2d_NCHWc_int8.cuda", [["TENSOR", [1, 256, 14, 14], "int8"], ["TENSOR", [512, 256, 3, 3], "int8"], [2, 2], [1, 1, 1, 1], [1, 1], "NCHW", "int32"], {}], "config": {"index": 2233132, "code_hash": null, "entity": [["tile_n", "sp", [-1, 1, 1, 1]], ["tile_f", "sp", [-1, 8, 4, 2]], ["tile_y", "sp", [-1, 7, 1, 1]], ["tile_x", "sp", [-1, 1, 1, 1]], ["fuse_yx", "ot", 1], ["tile_rc", "sp", [-1, 1]], ["tile_ry", "sp", [-1, 3]], ["tile_rx", "sp", [-1, 3]], ["reorder_inner", "re", [1, 0, 2]], ["AA_double_buffer", "ot", 1], ["WW_double_buffer", "ot", 1], ["auto_unroll_max_step", "ot", 0]]}, "result": [[0.01002163715], 0, 2.673680067062378, 1615490545.5887992], "version": 0.2, "tvm_version": "0.7.dev1"}
{"input": ["cuda -keys=cuda,gpu -max_num_threads=1024 -thread_warp_size=32", "conv2d_NCHWc_int8.cuda", [["TENSOR", [1, 256, 14, 14], "int8"], ["TENSOR", [512, 256, 3, 3], "int8"], [2, 2], [1, 1, 1, 1], [1, 1], "NCHW", "int32"], {}], "config": {"index": 995296, "code_hash": null, "entity": [["tile_n", "sp", [-1, 1, 1, 1]], ["tile_f", "sp", [-1, 2, 4, 1]], ["tile_y", "sp", [-1, 1, 7, 1]], ["tile_x", "sp", [-1, 7, 1, 1]], ["fuse_yx", "ot", 0], ["tile_rc", "sp", [-1, 1]], ["tile_ry", "sp", [-1, 3]], ["tile_rx", "sp", [-1, 1]], ["reorder_inner", "re", [1, 2, 0]], ["AA_double_buffer", "ot", 1], ["WW_double_buffer", "ot", 0], ["auto_unroll_max_step", "ot", 0]]}, "result": [[0.0003776765856697819], 0, 2.101715326309204, 1615490547.0766323], "version": 0.2, "tvm_version": "0.7.dev1"}
{"input": ["cuda -keys=cuda,gpu -max_num_threads=1024 -thread_warp_size=32", "conv2d_NCHWc_int8.cuda", [["TENSOR", [1, 256, 14, 14], "int8"], ["TENSOR", [512, 256, 3, 3], "int8"], [2, 2], [1, 1, 1, 1], [1, 1], "NCHW", "int32"], {}], "config": {"index": 2783528, "code_hash": null, "entity": [["tile_n", "sp", [-1, 1, 1, 1]], ["tile_f", "sp", [-1, 1, 2, 1]], ["tile_y", "sp", [-1, 1, 1, 1]], ["tile_x", "sp", [-1, 1, 1, 7]], ["fuse_yx", "ot", 1], ["tile_rc", "sp", [-1, 8]], ["tile_ry", "sp", [-1, 3]], ["tile_rx", "sp", [-1, 3]], ["reorder_inner", "re", [0, 2, 1]], ["AA_double_buffer", "ot", 0], ["WW_double_buffer", "ot", 0], ["auto_unroll_max_step", "ot", 512]]}, "result": [[0.0022040441136363634], 0, 10.213581800460815, 1615490568.71058], "version": 0.2, "tvm_version": "0.7.dev1"}
{"input": ["cuda -keys=cuda,gpu -max_num_threads=1024 -thread_warp_size=32", "conv2d_NCHWc_int8.cuda", [["TENSOR", [1, 256, 14, 14], "int8"], ["TENSOR", [512, 256, 3, 3], "int8"], [2, 2], [1, 1, 1, 1], [1, 1], "NCHW", "int32"], {}], "config": {"index": 5109975, "code_hash": null, "entity": [["tile_n", "sp", [-1, 1, 1, 1]], ["tile_f", "sp", [-1, 1, 4, 1]], ["tile_y", "sp", [-1, 1, 1, 7]], ["tile_x", "sp", [-1, 7, 1, 1]], ["fuse_yx", "ot", 1], ["tile_rc", "sp", [-1, 1]], ["tile_ry", "sp", [-1, 1]], ["tile_rx", "sp", [-1, 3]], ["reorder_inner", "re", [2, 1, 0]], ["AA_double_buffer", "ot", 1], ["WW_double_buffer", "ot", 1], ["auto_unroll_max_step", "ot", 512]]}, "result": [[0.002016980413333333], 0, 2.813640832901001, 1615490570.1018288], "version": 0.2, "tvm_version": "0.7.dev1"}
{"input": ["cuda -keys=cuda,gpu -max_num_threads=1024 -thread_warp_size=32", "conv2d_NCHWc_int8.cuda", [["TENSOR", [1, 256, 14, 14], "int8"], ["TENSOR", [512, 256, 3, 3], "int8"], [2, 2], [1, 1, 1, 1], [1, 1], "NCHW", "int32"], {}], "config": {"index": 2262304, "code_hash": null, "entity": [["tile_n", "sp", [-1, 1, 1, 1]], ["tile_f", "sp", [-1, 1, 1, 4]], ["tile_y", "sp", [-1, 1, 1, 1]], ["tile_x", "sp", [-1, 7, 1, 1]], ["fuse_yx", "ot", 0], ["tile_rc", "sp", [-1, 2]], ["tile_ry", "sp", [-1, 1]], ["tile_rx", "sp", [-1, 1]], ["reorder_inner", "re", [1, 2, 0]], ["AA_double_buffer", "ot", 1], ["WW_double_buffer", "ot", 1], ["auto_unroll_max_step", "ot", 0]]}, "result": [[0.00044944225149700604], 0, 1.7351429462432861, 1615490571.222379], "version": 0.2, "tvm_version": "0.7.dev1"}
{"input": ["cuda -keys=cuda,gpu -max_num_threads=1024 -thread_warp_size=32", "conv2d_NCHWc_int8.cuda", [["TENSOR", [1, 256, 14, 14], "int8"], ["TENSOR", [512, 256, 3, 3], "int8"], [2, 2], [1, 1, 1, 1], [1, 1], "NCHW", "int32"], {}], "config": {"index": 5219459, "code_hash": null, "entity": [["tile_n", "sp", [-1, 1, 1, 1]], ["tile_f", "sp", [-1, 2, 16, 2]], ["tile_y", "sp", [-1, 1, 1, 7]], ["tile_x", "sp", [-1, 7, 1, 1]], ["fuse_yx", "ot", 0], ["tile_rc", "sp", [-1, 2]], ["tile_ry", "sp", [-1, 1]], ["tile_rx", "sp", [-1, 3]], ["reorder_inner", "re", [0, 1, 2]], ["AA_double_buffer", "ot", 0], ["WW_double_buffer", "ot", 0], ["auto_unroll_max_step", "ot", 1500]]}, "result": [[0.0079883885], 0, 7.029669523239136, 1615490574.7321227], "version": 0.2, "tvm_version": "0.7.dev1"}
{"input": ["cuda -keys=cuda,gpu -max_num_threads=1024 -thread_warp_size=32", "conv2d_NCHWc_int8.cuda", [["TENSOR", [1, 256, 14, 14], "int8"], ["TENSOR", [512, 256, 3, 3], "int8"], [2, 2], [1, 1, 1, 1], [1, 1], "NCHW", "int32"], {}], "config": {"index": 5628969, "code_hash": null, "entity": [["tile_n", "sp", [-1, 1, 1, 1]], ["tile_f", "sp", [-1, 2, 2, 1]], ["tile_y", "sp", [-1, 1, 1, 1]], ["tile_x", "sp", [-1, 1, 1, 7]], ["fuse_yx", "ot", 1], ["tile_rc", "sp", [-1, 4]], ["tile_ry", "sp", [-1, 3]], ["tile_rx", "sp", [-1, 1]], ["reorder_inner", "re", [2, 0, 1]], ["AA_double_buffer", "ot", 0], ["WW_double_buffer", "ot", 0], ["auto_unroll_max_step", "ot", 1500]]}, "result": [[0.0014944810891089108], 0, 6.15046238899231, 1615490576.5477803], "version": 0.2, "tvm_version": "0.7.dev1"}
{"input": ["cuda -keys=cuda,gpu -max_num_threads=1024 -thread_warp_size=32", "conv2d_NCHWc_int8.cuda", [["TENSOR", [1, 256, 14, 14], "int8"], ["TENSOR", [512, 256, 3, 3], "int8"], [2, 2], [1, 1, 1, 1], [1, 1], "NCHW", "int32"], {}], "config": {"index": 600583, "code_hash": null, "entity": [["tile_n", "sp", [-1, 1, 1, 1]], ["tile_f", "sp", [-1, 8, 1, 16]], ["tile_y", "sp", [-1, 1, 1, 1]], ["tile_x", "sp", [-1, 1, 1, 7]], ["fuse_yx", "ot", 0], ["tile_rc", "sp", [-1, 4]], ["tile_ry", "sp", [-1, 1]], ["tile_rx", "sp", [-1, 3]], ["reorder_inner", "re", [2, 1, 0]], ["AA_double_buffer", "ot", 0], ["WW_double_buffer", "ot", 0], ["auto_unroll_max_step", "ot", 0]]}, "result": [[0.043695166699999996], 0, 4.526537895202637, 1615490581.390871], "version": 0.2, "tvm_version": "0.7.dev1"}
{"input": ["cuda -keys=cuda,gpu -max_num_threads=1024 -thread_warp_size=32", "conv2d_NCHWc_int8.cuda", [["TENSOR", [1, 256, 14, 14], "int8"], ["TENSOR", [512, 256, 3, 3], "int8"], [2, 2], [1, 1, 1, 1], [1, 1], "NCHW", "int32"], {}], "config": {"index": 1532416, "code_hash": null, "entity": [["tile_n", "sp", [-1, 1, 1, 1]], ["tile_f", "sp", [-1, 2, 4, 1]], ["tile_y", "sp", [-1, 1, 7, 1]], ["tile_x", "sp", [-1, 1, 1, 1]], ["fuse_yx", "ot", 0], ["tile_rc", "sp", [-1, 1]], ["tile_ry", "sp", [-1, 3]], ["tile_rx", "sp", [-1, 1]], ["reorder_inner", "re", [1, 0, 2]], ["AA_double_buffer", "ot", 0], ["WW_double_buffer", "ot", 1], ["auto_unroll_max_step", "ot", 0]]}, "result": [[8.405916129032257e-05], 0, 1.7997431755065918, 1615490750.9137793], "version": 0.2, "tvm_version": "0.7.dev1"}
{"input": ["cuda -keys=cuda,gpu -max_num_threads=1024 -thread_warp_size=32", "conv2d_NCHWc_int8.cuda", [["TENSOR", [1, 256, 14, 14], "int8"], ["TENSOR", [512, 256, 3, 3], "int8"], [2, 2], [1, 1, 1, 1], [1, 1], "NCHW", "int32"], {}], "config": {"index": 1532415, "code_hash": null, "entity": [["tile_n", "sp", [-1, 1, 1, 1]], ["tile_f", "sp", [-1, 1, 4, 1]], ["tile_y", "sp", [-1, 1, 7, 1]], ["tile_x", "sp", [-1, 1, 1, 1]], ["fuse_yx", "ot", 0], ["tile_rc", "sp", [-1, 1]], ["tile_ry", "sp", [-1, 3]], ["tile_rx", "sp", [-1, 1]], ["reorder_inner", "re", [1, 0, 2]], ["AA_double_buffer", "ot", 0], ["WW_double_buffer", "ot", 1], ["auto_unroll_max_step", "ot", 0]]}, "result": [[7.172313589897774e-05], 0, 1.9030663967132568, 1615490752.3723927], "version": 0.2, "tvm_version": "0.7.dev1"}
{"input": ["cuda -keys=cuda,gpu -max_num_threads=1024 -thread_warp_size=32", "conv2d_NCHWc_int8.cuda", [["TENSOR", [1, 256, 14, 14], "int8"], ["TENSOR", [512, 256, 3, 3], "int8"], [2, 2], [1, 1, 1, 1], [1, 1], "NCHW", "int32"], {}], "config": {"index": 242176, "code_hash": null, "entity": [["tile_n", "sp", [-1, 1, 1, 1]], ["tile_f", "sp", [-1, 2, 4, 1]], ["tile_y", "sp", [-1, 1, 7, 1]], ["tile_x", "sp", [-1, 1, 1, 1]], ["fuse_yx", "ot", 0], ["tile_rc", "sp", [-1, 1]], ["tile_ry", "sp", [-1, 3]], ["tile_rx", "sp", [-1, 1]], ["reorder_inner", "re", [1, 0, 2]], ["AA_double_buffer", "ot", 0], ["WW_double_buffer", "ot", 0], ["auto_unroll_max_step", "ot", 0]]}, "result": [[8.973582037932317e-05], 0, 1.8920528888702393, 1615490753.8420494], "version": 0.2, "tvm_version": "0.7.dev1"}
{"input": ["cuda -keys=cuda,gpu -max_num_threads=1024 -thread_warp_size=32", "conv2d_NCHWc_int8.cuda", [["TENSOR", [1, 256, 14, 14], "int8"], ["TENSOR", [512, 256, 3, 3], "int8"], [2, 2], [1, 1, 1, 1], [1, 1], "NCHW", "int32"], {}], "config": {"index": 242175, "code_hash": null, "entity": [["tile_n", "sp", [-1, 1, 1, 1]], ["tile_f", "sp", [-1, 1, 4, 1]], ["tile_y", "sp", [-1, 1, 7, 1]], ["tile_x", "sp", [-1, 1, 1, 1]], ["fuse_yx", "ot", 0], ["tile_rc", "sp", [-1, 1]], ["tile_ry", "sp", [-1, 3]], ["tile_rx", "sp", [-1, 1]], ["reorder_inner", "re", [1, 0, 2]], ["AA_double_buffer", "ot", 0], ["WW_double_buffer", "ot", 0], ["auto_unroll_max_step", "ot", 0]]}, "result": [[7.304166323128221e-05], 0, 1.9992573261260986, 1615490755.3027155], "version": 0.2, "tvm_version": "0.7.dev1"}
{"input": ["cuda -keys=cuda,gpu -max_num_threads=1024 -thread_warp_size=32", "conv2d_NCHWc_int8.cuda", [["TENSOR", [1, 256, 14, 14], "int8"], ["TENSOR", [512, 256, 3, 3], "int8"], [2, 2], [1, 1, 1, 1], [1, 1], "NCHW", "int32"], {}], "config": {"index": 1775546, "code_hash": null, "entity": [["tile_n", "sp", [-1, 1, 1, 1]], ["tile_f", "sp", [-1, 1, 16, 1]], ["tile_y", "sp", [-1, 1, 1, 1]], ["tile_x", "sp", [-1, 1, 1, 7]], ["fuse_yx", "ot", 0], ["tile_rc", "sp", [-1, 1]], ["tile_ry", "sp", [-1, 1]], ["tile_rx", "sp", [-1, 3]], ["reorder_inner", "re", [2, 0, 1]], ["AA_double_buffer", "ot", 0], ["WW_double_buffer", "ot", 1], ["auto_unroll_max_step", "ot", 0]]}, "result": [[0.000122835250380904], 0, 2.230271816253662, 1615490756.790182], "version": 0.2, "tvm_version": "0.7.dev1"}
{"input": ["cuda -keys=cuda,gpu -max_num_threads=1024 -thread_warp_size=32", "conv2d_NCHWc_int8.cuda", [["TENSOR", [1, 256, 14, 14], "int8"], ["TENSOR", [512, 256, 3, 3], "int8"], [2, 2], [1, 1, 1, 1], [1, 1], "NCHW", "int32"], {}], "config": {"index": 485296, "code_hash": null, "entity": [["tile_n", "sp", [-1, 1, 1, 1]], ["tile_f", "sp", [-1, 2, 4, 1]], ["tile_y", "sp", [-1, 1, 1, 1]], ["tile_x", "sp", [-1, 1, 1, 7]], ["fuse_yx", "ot", 0], ["tile_rc", "sp", [-1, 1]], ["tile_ry", "sp", [-1, 1]], ["tile_rx", "sp", [-1, 3]], ["reorder_inner", "re", [2, 0, 1]], ["AA_double_buffer", "ot", 0], ["WW_double_buffer", "ot", 0], ["auto_unroll_max_step", "ot", 0]]}, "result": [[0.00020491233446232006], 0, 2.265184164047241, 1615490758.3094258], "version": 0.2, "tvm_version": "0.7.dev1"}
{"input": ["cuda -keys=cuda,gpu -max_num_threads=1024 -thread_warp_size=32", "conv2d_NCHWc_int8.cuda", [["TENSOR", [1, 256, 14, 14], "int8"], ["TENSOR", [512, 256, 3, 3], "int8"], [2, 2], [1, 1, 1, 1], [1, 1], "NCHW", "int32"], {}], "config": {"index": 1775536, "code_hash": null, "entity": [["tile_n", "sp", [-1, 1, 1, 1]], ["tile_f", "sp", [-1, 2, 4, 1]], ["tile_y", "sp", [-1, 1, 1, 1]], ["tile_x", "sp", [-1, 1, 1, 7]], ["fuse_yx", "ot", 0], ["tile_rc", "sp", [-1, 1]], ["tile_ry", "sp", [-1, 1]], ["tile_rx", "sp", [-1, 3]], ["reorder_inner", "re", [2, 0, 1]], ["AA_double_buffer", "ot", 0], ["WW_double_buffer", "ot", 1], ["auto_unroll_max_step", "ot", 0]]}, "result": [[0.00020108558437240232], 0, 2.4076037406921387, 1615490759.8422787], "version": 0.2, "tvm_version": "0.7.dev1"}
{"input": ["cuda -keys=cuda,gpu -max_num_threads=1024 -thread_warp_size=32", "conv2d_NCHWc_int8.cuda", [["TENSOR", [1, 256, 14, 14], "int8"], ["TENSOR", [512, 256, 3, 3], "int8"], [2, 2], [1, 1, 1, 1], [1, 1], "NCHW", "int32"], {}], "config": {"index": 485306, "code_hash": null, "entity": [["tile_n", "sp", [-1, 1, 1, 1]], ["tile_f", "sp", [-1, 1, 16, 1]], ["tile_y", "sp", [-1, 1, 1, 1]], ["tile_x", "sp", [-1, 1, 1, 7]], ["fuse_yx", "ot", 0], ["tile_rc", "sp", [-1, 1]], ["tile_ry", "sp", [-1, 1]], ["tile_rx", "sp", [-1, 3]], ["reorder_inner", "re", [2, 0, 1]], ["AA_double_buffer", "ot", 0], ["WW_double_buffer", "ot", 0], ["auto_unroll_max_step", "ot", 0]]}, "result": [[0.00012526873523316062], 0, 2.242844820022583, 1615490761.326035], "version": 0.2, "tvm_version": "0.7.dev1"}
{"input": ["cuda -keys=cuda,gpu -max_num_threads=1024 -thread_warp_size=32", "conv2d_NCHWc_int8.cuda", [["TENSOR", [1, 256, 14, 14], "int8"], ["TENSOR", [512, 256, 3, 3], "int8"], [2, 2], [1, 1, 1, 1], [1, 1], "NCHW", "int32"], {}], "config": {"index": 1587376, "code_hash": null, "entity": [["tile_n", "sp", [-1, 1, 1, 1]], ["tile_f", "sp", [-1, 2, 4, 1]], ["tile_y", "sp", [-1, 1, 1, 1]], ["tile_x", "sp", [-1, 1, 1, 7]], ["fuse_yx", "ot", 0], ["tile_rc", "sp", [-1, 1]], ["tile_ry", "sp", [-1, 3]], ["tile_rx", "sp", [-1, 3]], ["reorder_inner", "re", [1, 0, 2]], ["AA_double_buffer", "ot", 0], ["WW_double_buffer", "ot", 1], ["auto_unroll_max_step", "ot", 0]]}, "result": [[0.0002022452522974102], 0, 2.5616321563720703, 1615490762.929441], "version": 0.2, "tvm_version": "0.7.dev1"}
{"input": ["cuda -keys=cuda,gpu -max_num_threads=1024 -thread_warp_size=32", "conv2d_NCHWc_int8.cuda", [["TENSOR", [1, 256, 14, 14], "int8"], ["TENSOR", [512, 256, 3, 3], "int8"], [2, 2], [1, 1, 1, 1], [1, 1], "NCHW", "int32"], {}], "config": {"index": 512176, "code_hash": null, "entity": [["tile_n", "sp", [-1, 1, 1, 1]], ["tile_f", "sp", [-1, 2, 4, 1]], ["tile_y", "sp", [-1, 1, 1, 1]], ["tile_x", "sp", [-1, 1, 1, 7]], ["fuse_yx", "ot", 0], ["tile_rc", "sp", [-1, 1]], ["tile_ry", "sp", [-1, 3]], ["tile_rx", "sp", [-1, 3]], ["reorder_inner", "re", [2, 0, 1]], ["AA_double_buffer", "ot", 0], ["WW_double_buffer", "ot", 0], ["auto_unroll_max_step", "ot", 0]]}, "result": [[0.00019196174047619047], 0, 2.2363593578338623, 1615490764.4577518], "version": 0.2, "tvm_version": "0.7.dev1"}
{"input": ["cuda -keys=cuda,gpu -max_num_threads=1024 -thread_warp_size=32", "conv2d_NCHWc_int8.cuda", [["TENSOR", [1, 256, 14, 14], "int8"], ["TENSOR", [512, 256, 3, 3], "int8"], [2, 2], [1, 1, 1, 1], [1, 1], "NCHW", "int32"], {}], "config": {"index": 297146, "code_hash": null, "entity": [["tile_n", "sp", [-1, 1, 1, 1]], ["tile_f", "sp", [-1, 1, 16, 1]], ["tile_y", "sp", [-1, 1, 1, 1]], ["tile_x", "sp", [-1, 1, 1, 7]], ["fuse_yx", "ot", 0], ["tile_rc", "sp", [-1, 1]], ["tile_ry", "sp", [-1, 3]], ["tile_rx", "sp", [-1, 3]], ["reorder_inner", "re", [1, 0, 2]], ["AA_double_buffer", "ot", 0], ["WW_double_buffer", "ot", 0], ["auto_unroll_max_step", "ot", 0]]}, "result": [[0.00013950152998846597], 0, 2.2026050090789795, 1615490765.939328], "version": 0.2, "tvm_version": "0.7.dev1"}
{"input": ["cuda -keys=cuda,gpu -max_num_threads=1024 -thread_warp_size=32", "conv2d_NCHWc_int8.cuda", [["TENSOR", [1, 256, 14, 14], "int8"], ["TENSOR", [512, 256, 3, 3], "int8"], [2, 2], [1, 1, 1, 1], [1, 1], "NCHW", "int32"], {}], "config": {"index": 1587386, "code_hash": null, "entity": [["tile_n", "sp", [-1, 1, 1, 1]], ["tile_f", "sp", [-1, 1, 16, 1]], ["tile_y", "sp", [-1, 1, 1, 1]], ["tile_x", "sp", [-1, 1, 1, 7]], ["fuse_yx", "ot", 0], ["tile_rc", "sp", [-1, 1]], ["tile_ry", "sp", [-1, 3]], ["tile_rx", "sp", [-1, 3]], ["reorder_inner", "re", [1, 0, 2]], ["AA_double_buffer", "ot", 0], ["WW_double_buffer", "ot", 1], ["auto_unroll_max_step", "ot", 0]]}, "result": [[0.00013414341453940067], 0, 2.318931818008423, 1615490767.442206], "version": 0.2, "tvm_version": "0.7.dev1"}
{"input": ["cuda -keys=cuda,gpu -max_num_threads=1024 -thread_warp_size=32", "conv2d_NCHWc_int8.cuda", [["TENSOR", [1, 256, 14, 14], "int8"], ["TENSOR", [512, 256, 3, 3], "int8"], [2, 2], [1, 1, 1, 1], [1, 1], "NCHW", "int32"], {}], "config": {"index": 297136, "code_hash": null, "entity": [["tile_n", "sp", [-1, 1, 1, 1]], ["tile_f", "sp", [-1, 2, 4, 1]], ["tile_y", "sp", [-1, 1, 1, 1]], ["tile_x", "sp", [-1, 1, 1, 7]], ["fuse_yx", "ot", 0], ["tile_rc", "sp", [-1, 1]], ["tile_ry", "sp", [-1, 3]], ["tile_rx", "sp", [-1, 3]], ["reorder_inner", "re", [1, 0, 2]], ["AA_double_buffer", "ot", 0], ["WW_double_buffer", "ot", 0], ["auto_unroll_max_step", "ot", 0]]}, "result": [[0.00021003021248915872], 0, 2.2091710567474365, 1615490768.9736154], "version": 0.2, "tvm_version": "0.7.dev1"}
{"input": ["cuda -keys=cuda,gpu -max_num_threads=1024 -thread_warp_size=32", "conv2d_NCHWc_int8.cuda", [["TENSOR", [1, 256, 14, 14], "int8"], ["TENSOR", [512, 256, 3, 3], "int8"], [2, 2], [1, 1, 1, 1], [1, 1], "NCHW", "int32"], {}], "config": {"index": 1802426, "code_hash": null, "entity": [["tile_n", "sp", [-1, 1, 1, 1]], ["tile_f", "sp", [-1, 1, 16, 1]], ["tile_y", "sp", [-1, 1, 1, 1]], ["tile_x", "sp", [-1, 1, 1, 7]], ["fuse_yx", "ot", 0], ["tile_rc", "sp", [-1, 1]], ["tile_ry", "sp", [-1, 3]], ["tile_rx", "sp", [-1, 3]], ["reorder_inner", "re", [2, 0, 1]], ["AA_double_buffer", "ot", 0], ["WW_double_buffer", "ot", 1], ["auto_unroll_max_step", "ot", 0]]}, "result": [[0.00013549644232922734], 0, 2.0978267192840576, 1615490770.4800136], "version": 0.2, "tvm_version": "0.7.dev1"}
{"input": ["cuda -keys=cuda,gpu -max_num_threads=1024 -thread_warp_size=32", "conv2d_NCHWc_int8.cuda", [["TENSOR", [1, 256, 14, 14], "int8"], ["TENSOR", [512, 256, 3, 3], "int8"], [2, 2], [1, 1, 1, 1], [1, 1], "NCHW", "int32"], {}], "config": {"index": 512186, "code_hash": null, "entity": [["tile_n", "sp", [-1, 1, 1, 1]], ["tile_f", "sp", [-1, 1, 16, 1]], ["tile_y", "sp", [-1, 1, 1, 1]], ["tile_x", "sp", [-1, 1, 1, 7]], ["fuse_yx", "ot", 0], ["tile_rc", "sp", [-1, 1]], ["tile_ry", "sp", [-1, 3]], ["tile_rx", "sp", [-1, 3]], ["reorder_inner", "re", [2, 0, 1]], ["AA_double_buffer", "ot", 0], ["WW_double_buffer", "ot", 0], ["auto_unroll_max_step", "ot", 0]]}, "result": [[0.00013470300891364902], 0, 2.0811123847961426, 1615490771.9631784], "version": 0.2, "tvm_version": "0.7.dev1"}
{"input": ["cuda -keys=cuda,gpu -max_num_threads=1024 -thread_warp_size=32", "conv2d_NCHWc_int8.cuda", [["TENSOR", [1, 256, 14, 14], "int8"], ["TENSOR", [512, 256, 3, 3], "int8"], [2, 2], [1, 1, 1, 1], [1, 1], "NCHW", "int32"], {}], "config": {"index": 1802416, "code_hash": null, "entity": [["tile_n", "sp", [-1, 1, 1, 1]], ["tile_f", "sp", [-1, 2, 4, 1]], ["tile_y", "sp", [-1, 1, 1, 1]], ["tile_x", "sp", [-1, 1, 1, 7]], ["fuse_yx", "ot", 0], ["tile_rc", "sp", [-1, 1]], ["tile_ry", "sp", [-1, 3]], ["tile_rx", "sp", [-1, 3]], ["reorder_inner", "re", [2, 0, 1]], ["AA_double_buffer", "ot", 0], ["WW_double_buffer", "ot", 1], ["auto_unroll_max_step", "ot", 0]]}, "result": [[0.0001918023383518225], 0, 2.160957098007202, 1615490773.5659578], "version": 0.2, "tvm_version": "0.7.dev1"}
{"input": ["cuda -keys=cuda,gpu -max_num_threads=1024 -thread_warp_size=32", "conv2d_NCHWc_int8.cuda", [["TENSOR", [1, 256, 14, 14], "int8"], ["TENSOR", [512, 256, 3, 3], "int8"], [2, 2], [1, 1, 1, 1], [1, 1], "NCHW", "int32"], {}], "config": {"index": 1643776, "code_hash": null, "entity": [["tile_n", "sp", [-1, 1, 1, 1]], ["tile_f", "sp", [-1, 2, 4, 1]], ["tile_y", "sp", [-1, 1, 7, 1]], ["tile_x", "sp", [-1, 1, 1, 1]], ["fuse_yx", "ot", 0], ["tile_rc", "sp", [-1, 2]], ["tile_ry", "sp", [-1, 3]], ["tile_rx", "sp", [-1, 1]], ["reorder_inner", "re", [1, 2, 0]], ["AA_double_buffer", "ot", 0], ["WW_double_buffer", "ot", 1], ["auto_unroll_max_step", "ot", 0]]}, "result": [[9.909134730913642e-05], 0, 1.8017230033874512, 1615490778.0000558], "version": 0.2, "tvm_version": "0.7.dev1"}
{"input": ["cuda -keys=cuda,gpu -max_num_threads=1024 -thread_warp_size=32", "conv2d_NCHWc_int8.cuda", [["TENSOR", [1, 256, 14, 14], "int8"], ["TENSOR", [512, 256, 3, 3], "int8"], [2, 2], [1, 1, 1, 1], [1, 1], "NCHW", "int32"], {}], "config": {"index": 353541, "code_hash": null, "entity": [["tile_n", "sp", [-1, 1, 1, 1]], ["tile_f", "sp", [-1, 1, 8, 1]], ["tile_y", "sp", [-1, 1, 7, 1]], ["tile_x", "sp", [-1, 1, 1, 1]], ["fuse_yx", "ot", 0], ["tile_rc", "sp", [-1, 2]], ["tile_ry", "sp", [-1, 3]], ["tile_rx", "sp", [-1, 1]], ["reorder_inner", "re", [1, 2, 0]], ["AA_double_buffer", "ot", 0], ["WW_double_buffer", "ot", 0], ["auto_unroll_max_step", "ot", 0]]}, "result": [[5.805682807608957e-05], 0, 1.947035789489746, 1615490779.5488887], "version": 0.2, "tvm_version": "0.7.dev1"}
{"input": ["cuda -keys=cuda,gpu -max_num_threads=1024 -thread_warp_size=32", "conv2d_NCHWc_int8.cuda", [["TENSOR", [1, 256, 14, 14], "int8"], ["TENSOR", [512, 256, 3, 3], "int8"], [2, 2], [1, 1, 1, 1], [1, 1], "NCHW", "int32"], {}], "config": {"index": 1643775, "code_hash": null, "entity": [["tile_n", "sp", [-1, 1, 1, 1]], ["tile_f", "sp", [-1, 1, 4, 1]], ["tile_y", "sp", [-1, 1, 7, 1]], ["tile_x", "sp", [-1, 1, 1, 1]], ["fuse_yx", "ot", 0], ["tile_rc", "sp", [-1, 2]], ["tile_ry", "sp", [-1, 3]], ["tile_rx", "sp", [-1, 1]], ["reorder_inner", "re", [1, 2, 0]], ["AA_double_buffer", "ot", 0], ["WW_double_buffer", "ot", 1], ["auto_unroll_max_step", "ot", 0]]}, "result": [[7.864450652741515e-05], 0, 2.0132620334625244, 1615490781.0173464], "version": 0.2, "tvm_version": "0.7.dev1"}
{"input": ["cuda -keys=cuda,gpu -max_num_threads=1024 -thread_warp_size=32", "conv2d_NCHWc_int8.cuda", [["TENSOR", [1, 256, 14, 14], "int8"], ["TENSOR", [512, 256, 3, 3], "int8"], [2, 2], [1, 1, 1, 1], [1, 1], "NCHW", "int32"], {}], "config": {"index": 353535, "code_hash": null, "entity": [["tile_n", "sp", [-1, 1, 1, 1]], ["tile_f", "sp", [-1, 1, 4, 1]], ["tile_y", "sp", [-1, 1, 7, 1]], ["tile_x", "sp", [-1, 1, 1, 1]], ["fuse_yx", "ot", 0], ["tile_rc", "sp", [-1, 2]], ["tile_ry", "sp", [-1, 3]], ["tile_rx", "sp", [-1, 1]], ["reorder_inner", "re", [1, 2, 0]], ["AA_double_buffer", "ot", 0], ["WW_double_buffer", "ot", 0], ["auto_unroll_max_step", "ot", 0]]}, "result": [[7.529396529080676e-05], 0, 2.007469654083252, 1615490782.5810518], "version": 0.2, "tvm_version": "0.7.dev1"}
{"input": ["cuda -keys=cuda,gpu -max_num_threads=1024 -thread_warp_size=32", "conv2d_NCHWc_int8.cuda", [["TENSOR", [1, 256, 14, 14], "int8"], ["TENSOR", [512, 256, 3, 3], "int8"], [2, 2], [1, 1, 1, 1], [1, 1], "NCHW", "int32"], {}], "config": {"index": 353536, "code_hash": null, "entity": [["tile_n", "sp", [-1, 1, 1, 1]], ["tile_f", "sp", [-1, 2, 4, 1]], ["tile_y", "sp", [-1, 1, 7, 1]], ["tile_x", "sp", [-1, 1, 1, 1]], ["fuse_yx", "ot", 0], ["tile_rc", "sp", [-1, 2]], ["tile_ry", "sp", [-1, 3]], ["tile_rx", "sp", [-1, 1]], ["reorder_inner", "re", [1, 2, 0]], ["AA_double_buffer", "ot", 0], ["WW_double_buffer", "ot", 0], ["auto_unroll_max_step", "ot", 0]]}, "result": [[0.00010798075279392043], 0, 2.3945436477661133, 1615490784.0537548], "version": 0.2, "tvm_version": "0.7.dev1"}
{"input": ["cuda -keys=cuda,gpu -max_num_threads=1024 -thread_warp_size=32", "conv2d_NCHWc_int8.cuda", [["TENSOR", [1, 256, 14, 14], "int8"], ["TENSOR", [512, 256, 3, 3], "int8"], [2, 2], [1, 1, 1, 1], [1, 1], "NCHW", "int32"], {}], "config": {"index": 1643781, "code_hash": null, "entity": [["tile_n", "sp", [-1, 1, 1, 1]], ["tile_f", "sp", [-1, 1, 8, 1]], ["tile_y", "sp", [-1, 1, 7, 1]], ["tile_x", "sp", [-1, 1, 1, 1]], ["fuse_yx", "ot", 0], ["tile_rc", "sp", [-1, 2]], ["tile_ry", "sp", [-1, 3]], ["tile_rx", "sp", [-1, 1]], ["reorder_inner", "re", [1, 2, 0]], ["AA_double_buffer", "ot", 0], ["WW_double_buffer", "ot", 1], ["auto_unroll_max_step", "ot", 0]]}, "result": [[5.889740269277846e-05], 0, 2.382366895675659, 1615490785.5241454], "version": 0.2, "tvm_version": "0.7.dev1"}
{"input": ["cuda -keys=cuda,gpu -max_num_threads=1024 -thread_warp_size=32", "conv2d_NCHWc_int8.cuda", [["TENSOR", [1, 256, 14, 14], "int8"], ["TENSOR", [512, 256, 3, 3], "int8"], [2, 2], [1, 1, 1, 1], [1, 1], "NCHW", "int32"], {}], "config": {"index": 1783216, "code_hash": null, "entity": [["tile_n", "sp", [-1, 1, 1, 1]], ["tile_f", "sp", [-1, 2, 4, 1]], ["tile_y", "sp", [-1, 1, 1, 1]], ["tile_x", "sp", [-1, 1, 1, 7]], ["fuse_yx", "ot", 0], ["tile_rc", "sp", [-1, 4]], ["tile_ry", "sp", [-1, 1]], ["tile_rx", "sp", [-1, 3]], ["reorder_inner", "re", [2, 0, 1]], ["AA_double_buffer", "ot", 0], ["WW_double_buffer", "ot", 1], ["auto_unroll_max_step", "ot", 0]]}, "result": [[0.00015043187562189056], 0, 2.7266743183135986, 1615490787.3128972], "version": 0.2, "tvm_version": "0.7.dev1"}
{"input": ["cuda -keys=cuda,gpu -max_num_threads=1024 -thread_warp_size=32", "conv2d_NCHWc_int8.cuda", [["TENSOR", [1, 256, 14, 14], "int8"], ["TENSOR", [512, 256, 3, 3], "int8"], [2, 2], [1, 1, 1, 1], [1, 1], "NCHW", "int32"], {}], "config": {"index": 489136, "code_hash": null, "entity": [["tile_n", "sp", [-1, 1, 1, 1]], ["tile_f", "sp", [-1, 2, 4, 1]], ["tile_y", "sp", [-1, 1, 1, 1]], ["tile_x", "sp", [-1, 1, 1, 7]], ["fuse_yx", "ot", 0], ["tile_rc", "sp", [-1, 2]], ["tile_ry", "sp", [-1, 1]], ["tile_rx", "sp", [-1, 3]], ["reorder_inner", "re", [2, 0, 1]], ["AA_double_buffer", "ot", 0], ["WW_double_buffer", "ot", 0], ["auto_unroll_max_step", "ot", 0]]}, "result": [[0.00019658978554021122], 0, 2.3935744762420654, 1615490788.9139802], "version": 0.2, "tvm_version": "0.7.dev1"}
{"input": ["cuda -keys=cuda,gpu -max_num_threads=1024 -thread_warp_size=32", "conv2d_NCHWc_int8.cuda", [["TENSOR", [1, 256, 14, 14], "int8"], ["TENSOR", [512, 256, 3, 3], "int8"], [2, 2], [1, 1, 1, 1], [1, 1], "NCHW", "int32"], {}], "config": {"index": 1779376, "code_hash": null, "entity": [["tile_n", "sp", [-1, 1, 1, 1]], ["tile_f", "sp", [-1, 2, 4, 1]], ["tile_y", "sp", [-1, 1, 1, 1]], ["tile_x", "sp", [-1, 1, 1, 7]], ["fuse_yx", "ot", 0], ["tile_rc", "sp", [-1, 2]], ["tile_ry", "sp", [-1, 1]], ["tile_rx", "sp", [-1, 3]], ["reorder_inner", "re", [2, 0, 1]], ["AA_double_buffer", "ot", 0], ["WW_double_buffer", "ot", 1], ["auto_unroll_max_step", "ot", 0]]}, "result": [[0.00019469433762057877], 0, 2.5577547550201416, 1615490790.524728], "version": 0.2, "tvm_version": "0.7.dev1"}
{"input": ["cuda -keys=cuda,gpu -max_num_threads=1024 -thread_warp_size=32", "conv2d_NCHWc_int8.cuda", [["TENSOR", [1, 256, 14, 14], "int8"], ["TENSOR", [512, 256, 3, 3], "int8"], [2, 2], [1, 1, 1, 1], [1, 1], "NCHW", "int32"], {}], "config": {"index": 489146, "code_hash": null, "entity": [["tile_n", "sp", [-1, 1, 1, 1]], ["tile_f", "sp", [-1, 1, 16, 1]], ["tile_y", "sp", [-1, 1, 1, 1]], ["tile_x", "sp", [-1, 1, 1, 7]], ["fuse_yx", "ot", 0], ["tile_rc", "sp", [-1, 2]], ["tile_ry", "sp", [-1, 1]], ["tile_rx", "sp", [-1, 3]], ["reorder_inner", "re", [2, 0, 1]], ["AA_double_buffer", "ot", 0], ["WW_double_buffer", "ot", 0], ["auto_unroll_max_step", "ot", 0]]}, "result": [[0.00016669621900826446], 0, 2.324286460876465, 1615490792.0060074], "version": 0.2, "tvm_version": "0.7.dev1"}
{"input": ["cuda -keys=cuda,gpu -max_num_threads=1024 -thread_warp_size=32", "conv2d_NCHWc_int8.cuda", [["TENSOR", [1, 256, 14, 14], "int8"], ["TENSOR", [512, 256, 3, 3], "int8"], [2, 2], [1, 1, 1, 1], [1, 1], "NCHW", "int32"], {}], "config": {"index": 1779386, "code_hash": null, "entity": [["tile_n", "sp", [-1, 1, 1, 1]], ["tile_f", "sp", [-1, 1, 16, 1]], ["tile_y", "sp", [-1, 1, 1, 1]], ["tile_x", "sp", [-1, 1, 1, 7]], ["fuse_yx", "ot", 0], ["tile_rc", "sp", [-1, 2]], ["tile_ry", "sp", [-1, 1]], ["tile_rx", "sp", [-1, 3]], ["reorder_inner", "re", [2, 0, 1]], ["AA_double_buffer", "ot", 0], ["WW_double_buffer", "ot", 1], ["auto_unroll_max_step", "ot", 0]]}, "result": [[0.0001655520875512996], 0, 2.1550168991088867, 1615490793.5044706], "version": 0.2, "tvm_version": "0.7.dev1"}
{"input": ["cuda -keys=cuda,gpu -max_num_threads=1024 -thread_warp_size=32", "conv2d_NCHWc_int8.cuda", [["TENSOR", [1, 256, 14, 14], "int8"], ["TENSOR", [512, 256, 3, 3], "int8"], [2, 2], [1, 1, 1, 1], [1, 1], "NCHW", "int32"], {}], "config": {"index": 492976, "code_hash": null, "entity": [["tile_n", "sp", [-1, 1, 1, 1]], ["tile_f", "sp", [-1, 2, 4, 1]], ["tile_y", "sp", [-1, 1, 1, 1]], ["tile_x", "sp", [-1, 1, 1, 7]], ["fuse_yx", "ot", 0], ["tile_rc", "sp", [-1, 4]], ["tile_ry", "sp", [-1, 1]], ["tile_rx", "sp", [-1, 3]], ["reorder_inner", "re", [2, 0, 1]], ["AA_double_buffer", "ot", 0], ["WW_double_buffer", "ot", 0], ["auto_unroll_max_step", "ot", 0]]}, "result": [[0.0001439271709350804], 0, 2.546006202697754, 1615490795.2578576], "version": 0.2, "tvm_version": "0.7.dev1"}
{"input": ["cuda -keys=cuda,gpu -max_num_threads=1024 -thread_warp_size=32", "conv2d_NCHWc_int8.cuda", [["TENSOR", [1, 256, 14, 14], "int8"], ["TENSOR", [512, 256, 3, 3], "int8"], [2, 2], [1, 1, 1, 1], [1, 1], "NCHW", "int32"], {}], "config": {"index": 274106, "code_hash": null, "entity": [["tile_n", "sp", [-1, 1, 1, 1]], ["tile_f", "sp", [-1, 1, 16, 1]], ["tile_y", "sp", [-1, 1, 1, 1]], ["tile_x", "sp", [-1, 1, 1, 7]], ["fuse_yx", "ot", 0], ["tile_rc", "sp", [-1, 2]], ["tile_ry", "sp", [-1, 1]], ["tile_rx", "sp", [-1, 3]], ["reorder_inner", "re", [1, 0, 2]], ["AA_double_buffer", "ot", 0], ["WW_double_buffer", "ot", 0], ["auto_unroll_max_step", "ot", 0]]}, "result": [[0.00016888926974143955], 0, 2.210036039352417, 1615490796.7368808], "version": 0.2, "tvm_version": "0.7.dev1"}
{"input": ["cuda -keys=cuda,gpu -max_num_threads=1024 -thread_warp_size=32", "conv2d_NCHWc_int8.cuda", [["TENSOR", [1, 256, 14, 14], "int8"], ["TENSOR", [512, 256, 3, 3], "int8"], [2, 2], [1, 1, 1, 1], [1, 1], "NCHW", "int32"], {}], "config": {"index": 1568176, "code_hash": null, "entity": [["tile_n", "sp", [-1, 1, 1, 1]], ["tile_f", "sp", [-1, 2, 4, 1]], ["tile_y", "sp", [-1, 1, 1, 1]], ["tile_x", "sp", [-1, 1, 1, 7]], ["fuse_yx", "ot", 0], ["tile_rc", "sp", [-1, 4]], ["tile_ry", "sp", [-1, 1]], ["tile_rx", "sp", [-1, 3]], ["reorder_inner", "re", [1, 0, 2]], ["AA_double_buffer", "ot", 0], ["WW_double_buffer", "ot", 1], ["auto_unroll_max_step", "ot", 0]]}, "result": [[0.00014880971955719558], 0, 2.3704886436462402, 1615490798.4091597], "version": 0.2, "tvm_version": "0.7.dev1"}
{"input": ["cuda -keys=cuda,gpu -max_num_threads=1024 -thread_warp_size=32", "conv2d_NCHWc_int8.cuda", [["TENSOR", [1, 256, 14, 14], "int8"], ["TENSOR", [512, 256, 3, 3], "int8"], [2, 2], [1, 1, 1, 1], [1, 1], "NCHW", "int32"], {}], "config": {"index": 1564346, "code_hash": null, "entity": [["tile_n", "sp", [-1, 1, 1, 1]], ["tile_f", "sp", [-1, 1, 16, 1]], ["tile_y", "sp", [-1, 1, 1, 1]], ["tile_x", "sp", [-1, 1, 1, 7]], ["fuse_yx", "ot", 0], ["tile_rc", "sp", [-1, 2]], ["tile_ry", "sp", [-1, 1]], ["tile_rx", "sp", [-1, 3]], ["reorder_inner", "re", [1, 0, 2]], ["AA_double_buffer", "ot", 0], ["WW_double_buffer", "ot", 1], ["auto_unroll_max_step", "ot", 0]]}, "result": [[0.00016548329616963066], 0, 2.0022146701812744, 1615490799.9067473], "version": 0.2, "tvm_version": "0.7.dev1"}
{"input": ["cuda -keys=cuda,gpu -max_num_threads=1024 -thread_warp_size=32", "conv2d_NCHWc_int8.cuda", [["TENSOR", [1, 256, 14, 14], "int8"], ["TENSOR", [512, 256, 3, 3], "int8"], [2, 2], [1, 1, 1, 1], [1, 1], "NCHW", "int32"], {}], "config": {"index": 274096, "code_hash": null, "entity": [["tile_n", "sp", [-1, 1, 1, 1]], ["tile_f", "sp", [-1, 2, 4, 1]], ["tile_y", "sp", [-1, 1, 1, 1]], ["tile_x", "sp", [-1, 1, 1, 7]], ["fuse_yx", "ot", 0], ["tile_rc", "sp", [-1, 2]], ["tile_ry", "sp", [-1, 1]], ["tile_rx", "sp", [-1, 3]], ["reorder_inner", "re", [1, 0, 2]], ["AA_double_buffer", "ot", 0], ["WW_double_buffer", "ot", 0], ["auto_unroll_max_step", "ot", 0]]}, "result": [[0.00020847458397932816], 0, 2.1160190105438232, 1615490801.419147], "version": 0.2, "tvm_version": "0.7.dev1"}
{"input": ["cuda -keys=cuda,gpu -max_num_threads=1024 -thread_warp_size=32", "conv2d_NCHWc_int8.cuda", [["TENSOR", [1, 256, 14, 14], "int8"], ["TENSOR", [512, 256, 3, 3], "int8"], [2, 2], [1, 1, 1, 1], [1, 1], "NCHW", "int32"], {}], "config": {"index": 277936, "code_hash": null, "entity": [["tile_n", "sp", [-1, 1, 1, 1]], ["tile_f", "sp", [-1, 2, 4, 1]], ["tile_y", "sp", [-1, 1, 1, 1]], ["tile_x", "sp", [-1, 1, 1, 7]], ["fuse_yx", "ot", 0], ["tile_rc", "sp", [-1, 4]], ["tile_ry", "sp", [-1, 1]], ["tile_rx", "sp", [-1, 3]], ["reorder_inner", "re", [1, 0, 2]], ["AA_double_buffer", "ot", 0], ["WW_double_buffer", "ot", 0], ["auto_unroll_max_step", "ot", 0]]}, "result": [[0.00016145620404040405], 0, 1.8332598209381104, 1615490805.7753959], "version": 0.2, "tvm_version": "0.7.dev1"}
{"input": ["cuda -keys=cuda,gpu -max_num_threads=1024 -thread_warp_size=32", "conv2d_NCHWc_int8.cuda", [["TENSOR", [1, 256, 14, 14], "int8"], ["TENSOR", [512, 256, 3, 3], "int8"], [2, 2], [1, 1, 1, 1], [1, 1], "NCHW", "int32"], {}], "config": {"index": 1639936, "code_hash": null, "entity": [["tile_n", "sp", [-1, 1, 1, 1]], ["tile_f", "sp", [-1, 2, 4, 1]], ["tile_y", "sp", [-1, 1, 7, 1]], ["tile_x", "sp", [-1, 1, 1, 1]], ["fuse_yx", "ot", 0], ["tile_rc", "sp", [-1, 1]], ["tile_ry", "sp", [-1, 3]], ["tile_rx", "sp", [-1, 1]], ["reorder_inner", "re", [1, 2, 0]], ["AA_double_buffer", "ot", 0], ["WW_double_buffer", "ot", 1], ["auto_unroll_max_step", "ot", 0]]}, "result": [[0.00010059795949367088], 0, 1.8869638442993164, 1615490807.2362583], "version": 0.2, "tvm_version": "0.7.dev1"}
{"input": ["cuda -keys=cuda,gpu -max_num_threads=1024 -thread_warp_size=32", "conv2d_NCHWc_int8.cuda", [["TENSOR", [1, 256, 14, 14], "int8"], ["TENSOR", [512, 256, 3, 3], "int8"], [2, 2], [1, 1, 1, 1], [1, 1], "NCHW", "int32"], {}], "config": {"index": 1639935, "code_hash": null, "entity": [["tile_n", "sp", [-1, 1, 1, 1]], ["tile_f", "sp", [-1, 1, 4, 1]], ["tile_y", "sp", [-1, 1, 7, 1]], ["tile_x", "sp", [-1, 1, 1, 1]], ["fuse_yx", "ot", 0], ["tile_rc", "sp", [-1, 1]], ["tile_ry", "sp", [-1, 3]], ["tile_rx", "sp", [-1, 1]], ["reorder_inner", "re", [1, 2, 0]], ["AA_double_buffer", "ot", 0], ["WW_double_buffer", "ot", 1], ["auto_unroll_max_step", "ot", 0]]}, "result": [[8.860921221037146e-05], 0, 1.9984920024871826, 1615490808.7016058], "version": 0.2, "tvm_version": "0.7.dev1"}
{"input": ["cuda -keys=cuda,gpu -max_num_threads=1024 -thread_warp_size=32", "conv2d_NCHWc_int8.cuda", [["TENSOR", [1, 256, 14, 14], "int8"], ["TENSOR", [512, 256, 3, 3], "int8"], [2, 2], [1, 1, 1, 1], [1, 1], "NCHW", "int32"], {}], "config": {"index": 349695, "code_hash": null, "entity": [["tile_n", "sp", [-1, 1, 1, 1]], ["tile_f", "sp", [-1, 1, 4, 1]], ["tile_y", "sp", [-1, 1, 7, 1]], ["tile_x", "sp", [-1, 1, 1, 1]], ["fuse_yx", "ot", 0], ["tile_rc", "sp", [-1, 1]], ["tile_ry", "sp", [-1, 3]], ["tile_rx", "sp", [-1, 1]], ["reorder_inner", "re", [1, 2, 0]], ["AA_double_buffer", "ot", 0], ["WW_double_buffer", "ot", 0], ["auto_unroll_max_step", "ot", 0]]}, "result": [[9.205779091949638e-05], 0, 2.030505895614624, 1615490810.2541342], "version": 0.2, "tvm_version": "0.7.dev1"}
{"input": ["cuda -keys=cuda,gpu -max_num_threads=1024 -thread_warp_size=32", "conv2d_NCHWc_int8.cuda", [["TENSOR", [1, 256, 14, 14], "int8"], ["TENSOR", [512, 256, 3, 3], "int8"], [2, 2], [1, 1, 1, 1], [1, 1], "NCHW", "int32"], {}], "config": {"index": 349696, "code_hash": null, "entity": [["tile_n", "sp", [-1, 1, 1, 1]], ["tile_f", "sp", [-1, 2, 4, 1]], ["tile_y", "sp", [-1, 1, 7, 1]], ["tile_x", "sp", [-1, 1, 1, 1]], ["fuse_yx", "ot", 0], ["tile_rc", "sp", [-1, 1]], ["tile_ry", "sp", [-1, 3]], ["tile_rx", "sp", [-1, 1]], ["reorder_inner", "re", [1, 2, 0]], ["AA_double_buffer", "ot", 0], ["WW_double_buffer", "ot", 0], ["auto_unroll_max_step", "ot", 0]]}, "result": [[0.00011177061360481259], 0, 2.328960657119751, 1615490811.7194731], "version": 0.2, "tvm_version": "0.7.dev1"}
{"input": ["cuda -keys=cuda,gpu -max_num_threads=1024 -thread_warp_size=32", "conv2d_NCHWc_int8.cuda", [["TENSOR", [1, 256, 14, 14], "int8"], ["TENSOR", [512, 256, 3, 3], "int8"], [2, 2], [1, 1, 1, 1], [1, 1], "NCHW", "int32"], {}], "config": {"index": 1783226, "code_hash": null, "entity": [["tile_n", "sp", [-1, 1, 1, 1]], ["tile_f", "sp", [-1, 1, 16, 1]], ["tile_y", "sp", [-1, 1, 1, 1]], ["tile_x", "sp", [-1, 1, 1, 7]], ["fuse_yx", "ot", 0], ["tile_rc", "sp", [-1, 4]], ["tile_ry", "sp", [-1, 1]], ["tile_rx", "sp", [-1, 3]], ["reorder_inner", "re", [2, 0, 1]], ["AA_double_buffer", "ot", 0], ["WW_double_buffer", "ot", 1], ["auto_unroll_max_step", "ot", 0]]}, "result": [[0.00016115271789753826], 0, 2.4473307132720947, 1615490813.242891], "version": 0.2, "tvm_version": "0.7.dev1"}
{"input": ["cuda -keys=cuda,gpu -max_num_threads=1024 -thread_warp_size=32", "conv2d_NCHWc_int8.cuda", [["TENSOR", [1, 256, 14, 14], "int8"], ["TENSOR", [512, 256, 3, 3], "int8"], [2, 2], [1, 1, 1, 1], [1, 1], "NCHW", "int32"], {}], "config": {"index": 492986, "code_hash": null, "entity": [["tile_n", "sp", [-1, 1, 1, 1]], ["tile_f", "sp", [-1, 1, 16, 1]], ["tile_y", "sp", [-1, 1, 1, 1]], ["tile_x", "sp", [-1, 1, 1, 7]], ["fuse_yx", "ot", 0], ["tile_rc", "sp", [-1, 4]], ["tile_ry", "sp", [-1, 1]], ["tile_rx", "sp", [-1, 3]], ["reorder_inner", "re", [2, 0, 1]], ["AA_double_buffer", "ot", 0], ["WW_double_buffer", "ot", 0], ["auto_unroll_max_step", "ot", 0]]}, "result": [[0.0001618548736631016], 0, 2.135575771331787, 1615490814.7361262], "version": 0.2, "tvm_version": "0.7.dev1"}
{"input": ["cuda -keys=cuda,gpu -max_num_threads=1024 -thread_warp_size=32", "conv2d_NCHWc_int8.cuda", [["TENSOR", [1, 256, 14, 14], "int8"], ["TENSOR", [512, 256, 3, 3], "int8"], [2, 2], [1, 1, 1, 1], [1, 1], "NCHW", "int32"], {}], "config": {"index": 485297, "code_hash": null, "entity": [["tile_n", "sp", [-1, 1, 1, 1]], ["tile_f", "sp", [-1, 4, 4, 1]], ["tile_y", "sp", [-1, 1, 1, 1]], ["tile_x", "sp", [-1, 1, 1, 7]], ["fuse_yx", "ot", 0], ["tile_rc", "sp", [-1, 1]], ["tile_ry", "sp", [-1, 1]], ["tile_rx", "sp", [-1, 3]], ["reorder_inner", "re", [2, 0, 1]], ["AA_double_buffer", "ot", 0], ["WW_double_buffer", "ot", 0], ["auto_unroll_max_step", "ot", 0]]}, "result": [[0.0002774259931271478], 0, 2.5430212020874023, 1615490816.353472], "version": 0.2, "tvm_version": "0.7.dev1"}
{"input": ["cuda -keys=cuda,gpu -max_num_threads=1024 -thread_warp_size=32", "conv2d_NCHWc_int8.cuda", [["TENSOR", [1, 256, 14, 14], "int8"], ["TENSOR", [512, 256, 3, 3], "int8"], [2, 2], [1, 1, 1, 1], [1, 1], "NCHW", "int32"], {}], "config": {"index": 1775537, "code_hash": null, "entity": [["tile_n", "sp", [-1, 1, 1, 1]], ["tile_f", "sp", [-1, 4, 4, 1]], ["tile_y", "sp", [-1, 1, 1, 1]], ["tile_x", "sp", [-1, 1, 1, 7]], ["fuse_yx", "ot", 0], ["tile_rc", "sp", [-1, 1]], ["tile_ry", "sp", [-1, 1]], ["tile_rx", "sp", [-1, 3]], ["reorder_inner", "re", [2, 0, 1]], ["AA_double_buffer", "ot", 0], ["WW_double_buffer", "ot", 1], ["auto_unroll_max_step", "ot", 0]]}, "result": [[0.00027404938305084745], 0, 2.614302158355713, 1615490817.9767814], "version": 0.2, "tvm_version": "0.7.dev1"}
{"input": ["cuda -keys=cuda,gpu -max_num_threads=1024 -thread_warp_size=32", "conv2d_NCHWc_int8.cuda", [["TENSOR", [1, 256, 14, 14], "int8"], ["TENSOR", [512, 256, 3, 3], "int8"], [2, 2], [1, 1, 1, 1], [1, 1], "NCHW", "int32"], {}], "config": {"index": 297137, "code_hash": null, "entity": [["tile_n", "sp", [-1, 1, 1, 1]], ["tile_f", "sp", [-1, 4, 4, 1]], ["tile_y", "sp", [-1, 1, 1, 1]], ["tile_x", "sp", [-1, 1, 1, 7]], ["fuse_yx", "ot", 0], ["tile_rc", "sp", [-1, 1]], ["tile_ry", "sp", [-1, 3]], ["tile_rx", "sp", [-1, 3]], ["reorder_inner", "re", [1, 0, 2]], ["AA_double_buffer", "ot", 0], ["WW_double_buffer", "ot", 0], ["auto_unroll_max_step", "ot", 0]]}, "result": [[0.0002775882714776632], 0, 2.5242831707000732, 1615490819.6179125], "version": 0.2, "tvm_version": "0.7.dev1"}
{"input": ["cuda -keys=cuda,gpu -max_num_threads=1024 -thread_warp_size=32", "conv2d_NCHWc_int8.cuda", [["TENSOR", [1, 256, 14, 14], "int8"], ["TENSOR", [512, 256, 3, 3], "int8"], [2, 2], [1, 1, 1, 1], [1, 1], "NCHW", "int32"], {}], "config": {"index": 512177, "code_hash": null, "entity": [["tile_n", "sp", [-1, 1, 1, 1]], ["tile_f", "sp", [-1, 4, 4, 1]], ["tile_y", "sp", [-1, 1, 1, 1]], ["tile_x", "sp", [-1, 1, 1, 7]], ["fuse_yx", "ot", 0], ["tile_rc", "sp", [-1, 1]], ["tile_ry", "sp", [-1, 3]], ["tile_rx", "sp", [-1, 3]], ["reorder_inner", "re", [2, 0, 1]], ["AA_double_buffer", "ot", 0], ["WW_double_buffer", "ot", 0], ["auto_unroll_max_step", "ot", 0]]}, "result": [[0.0002802375317919075], 0, 2.4788432121276855, 1615490821.2555287], "version": 0.2, "tvm_version": "0.7.dev1"}
{"input": ["cuda -keys=cuda,gpu -max_num_threads=1024 -thread_warp_size=32", "conv2d_NCHWc_int8.cuda", [["TENSOR", [1, 256, 14, 14], "int8"], ["TENSOR", [512, 256, 3, 3], "int8"], [2, 2], [1, 1, 1, 1], [1, 1], "NCHW", "int32"], {}], "config": {"index": 1587377, "code_hash": null, "entity": [["tile_n", "sp", [-1, 1, 1, 1]], ["tile_f", "sp", [-1, 4, 4, 1]], ["tile_y", "sp", [-1, 1, 1, 1]], ["tile_x", "sp", [-1, 1, 1, 7]], ["fuse_yx", "ot", 0], ["tile_rc", "sp", [-1, 1]], ["tile_ry", "sp", [-1, 3]], ["tile_rx", "sp", [-1, 3]], ["reorder_inner", "re", [1, 0, 2]], ["AA_double_buffer", "ot", 0], ["WW_double_buffer", "ot", 1], ["auto_unroll_max_step", "ot", 0]]}, "result": [[0.00031776741338582676], 0, 2.7277891635894775, 1615490823.0869436], "version": 0.2, "tvm_version": "0.7.dev1"}
{"input": ["cuda -keys=cuda,gpu -max_num_threads=1024 -thread_warp_size=32", "conv2d_NCHWc_int8.cuda", [["TENSOR", [1, 256, 14, 14], "int8"], ["TENSOR", [512, 256, 3, 3], "int8"], [2, 2], [1, 1, 1, 1], [1, 1], "NCHW", "int32"], {}], "config": {"index": 1802417, "code_hash": null, "entity": [["tile_n", "sp", [-1, 1, 1, 1]], ["tile_f", "sp", [-1, 4, 4, 1]], ["tile_y", "sp", [-1, 1, 1, 1]], ["tile_x", "sp", [-1, 1, 1, 7]], ["fuse_yx", "ot", 0], ["tile_rc", "sp", [-1, 1]], ["tile_ry", "sp", [-1, 3]], ["tile_rx", "sp", [-1, 3]], ["reorder_inner", "re", [2, 0, 1]], ["AA_double_buffer", "ot", 0], ["WW_double_buffer", "ot", 1], ["auto_unroll_max_step", "ot", 0]]}, "result": [[0.00031775845871559634], 0, 2.6037702560424805, 1615490824.8315938], "version": 0.2, "tvm_version": "0.7.dev1"}
{"input": ["cuda -keys=cuda,gpu -max_num_threads=1024 -thread_warp_size=32", "conv2d_NCHWc_int8.cuda", [["TENSOR", [1, 256, 14, 14], "int8"], ["TENSOR", [512, 256, 3, 3], "int8"], [2, 2], [1, 1, 1, 1], [1, 1], "NCHW", "int32"], {}], "config": {"index": 246015, "code_hash": null, "entity": [["tile_n", "sp", [-1, 1, 1, 1]], ["tile_f", "sp", [-1, 1, 4, 1]], ["tile_y", "sp", [-1, 1, 7, 1]], ["tile_x", "sp", [-1, 1, 1, 1]], ["fuse_yx", "ot", 0], ["tile_rc", "sp", [-1, 2]], ["tile_ry", "sp", [-1, 3]], ["tile_rx", "sp", [-1, 1]], ["reorder_inner", "re", [1, 0, 2]], ["AA_double_buffer", "ot", 0], ["WW_double_buffer", "ot", 0], ["auto_unroll_max_step", "ot", 0]]}, "result": [[5.367731622405713e-05], 0, 2.117095708847046, 1615490826.300147], "version": 0.2, "tvm_version": "0.7.dev1"}
{"input": ["cuda -keys=cuda,gpu -max_num_threads=1024 -thread_warp_size=32", "conv2d_NCHWc_int8.cuda", [["TENSOR", [1, 256, 14, 14], "int8"], ["TENSOR", [512, 256, 3, 3], "int8"], [2, 2], [1, 1, 1, 1], [1, 1], "NCHW", "int32"], {}], "config": {"index": 1536255, "code_hash": null, "entity": [["tile_n", "sp", [-1, 1, 1, 1]], ["tile_f", "sp", [-1, 1, 4, 1]], ["tile_y", "sp", [-1, 1, 7, 1]], ["tile_x", "sp", [-1, 1, 1, 1]], ["fuse_yx", "ot", 0], ["tile_rc", "sp", [-1, 2]], ["tile_ry", "sp", [-1, 3]], ["tile_rx", "sp", [-1, 1]], ["reorder_inner", "re", [1, 0, 2]], ["AA_double_buffer", "ot", 0], ["WW_double_buffer", "ot", 1], ["auto_unroll_max_step", "ot", 0]]}, "result": [[5.497970215201465e-05], 0, 2.040362596511841, 1615490827.770973], "version": 0.2, "tvm_version": "0.7.dev1"}
{"input": ["cuda -keys=cuda,gpu -max_num_threads=1024 -thread_warp_size=32", "conv2d_NCHWc_int8.cuda", [["TENSOR", [1, 256, 14, 14], "int8"], ["TENSOR", [512, 256, 3, 3], "int8"], [2, 2], [1, 1, 1, 1], [1, 1], "NCHW", "int32"], {}], "config": {"index": 246021, "code_hash": null, "entity": [["tile_n", "sp", [-1, 1, 1, 1]], ["tile_f", "sp", [-1, 1, 8, 1]], ["tile_y", "sp", [-1, 1, 7, 1]], ["tile_x", "sp", [-1, 1, 1, 1]], ["fuse_yx", "ot", 0], ["tile_rc", "sp", [-1, 2]], ["tile_ry", "sp", [-1, 3]], ["tile_rx", "sp", [-1, 1]], ["reorder_inner", "re", [1, 0, 2]], ["AA_double_buffer", "ot", 0], ["WW_double_buffer", "ot", 0], ["auto_unroll_max_step", "ot", 0]]}, "result": [[4.9216214798114365e-05], 0, 1.909804105758667, 1615490829.23641], "version": 0.2, "tvm_version": "0.7.dev1"}
{"input": ["cuda -keys=cuda,gpu -max_num_threads=1024 -thread_warp_size=32", "conv2d_NCHWc_int8.cuda", [["TENSOR", [1, 256, 14, 14], "int8"], ["TENSOR", [512, 256, 3, 3], "int8"], [2, 2], [1, 1, 1, 1], [1, 1], "NCHW", "int32"], {}], "config": {"index": 246016, "code_hash": null, "entity": [["tile_n", "sp", [-1, 1, 1, 1]], ["tile_f", "sp", [-1, 2, 4, 1]], ["tile_y", "sp", [-1, 1, 7, 1]], ["tile_x", "sp", [-1, 1, 1, 1]], ["fuse_yx", "ot", 0], ["tile_rc", "sp", [-1, 2]], ["tile_ry", "sp", [-1, 3]], ["tile_rx", "sp", [-1, 1]], ["reorder_inner", "re", [1, 0, 2]], ["AA_double_buffer", "ot", 0], ["WW_double_buffer", "ot", 0], ["auto_unroll_max_step", "ot", 0]]}, "result": [[7.097713153070578e-05], 0, 1.727581262588501, 1615490842.3270097], "version": 0.2, "tvm_version": "0.7.dev1"}
{"input": ["cuda -keys=cuda,gpu -max_num_threads=1024 -thread_warp_size=32", "conv2d_NCHWc_int8.cuda", [["TENSOR", [1, 256, 14, 14], "int8"], ["TENSOR", [512, 256, 3, 3], "int8"], [2, 2], [1, 1, 1, 1], [1, 1], "NCHW", "int32"], {}], "config": {"index": 1536256, "code_hash": null, "entity": [["tile_n", "sp", [-1, 1, 1, 1]], ["tile_f", "sp", [-1, 2, 4, 1]], ["tile_y", "sp", [-1, 1, 7, 1]], ["tile_x", "sp", [-1, 1, 1, 1]], ["fuse_yx", "ot", 0], ["tile_rc", "sp", [-1, 2]], ["tile_ry", "sp", [-1, 3]], ["tile_rx", "sp", [-1, 1]], ["reorder_inner", "re", [1, 0, 2]], ["AA_double_buffer", "ot", 0], ["WW_double_buffer", "ot", 1], ["auto_unroll_max_step", "ot", 0]]}, "result": [[7.581325267127592e-05], 0, 2.000211715698242, 1615490843.8147297], "version": 0.2, "tvm_version": "0.7.dev1"}
{"input": ["cuda -keys=cuda,gpu -max_num_threads=1024 -thread_warp_size=32", "conv2d_NCHWc_int8.cuda", [["TENSOR", [1, 256, 14, 14], "int8"], ["TENSOR", [512, 256, 3, 3], "int8"], [2, 2], [1, 1, 1, 1], [1, 1], "NCHW", "int32"], {}], "config": {"index": 1587381, "code_hash": null, "entity": [["tile_n", "sp", [-1, 1, 1, 1]], ["tile_f", "sp", [-1, 1, 8, 1]], ["tile_y", "sp", [-1, 1, 1, 1]], ["tile_x", "sp", [-1, 1, 1, 7]], ["fuse_yx", "ot", 0], ["tile_rc", "sp", [-1, 1]], ["tile_ry", "sp", [-1, 3]], ["tile_rx", "sp", [-1, 3]], ["reorder_inner", "re", [1, 0, 2]], ["AA_double_buffer", "ot", 0], ["WW_double_buffer", "ot", 1], ["auto_unroll_max_step", "ot", 0]]}, "result": [[0.00016613529855868223], 0, 2.046480894088745, 1615490845.323638], "version": 0.2, "tvm_version": "0.7.dev1"}
{"input": ["cuda -keys=cuda,gpu -max_num_threads=1024 -thread_warp_size=32", "conv2d_NCHWc_int8.cuda", [["TENSOR", [1, 256, 14, 14], "int8"], ["TENSOR", [512, 256, 3, 3], "int8"], [2, 2], [1, 1, 1, 1], [1, 1], "NCHW", "int32"], {}], "config": {"index": 512181, "code_hash": null, "entity": [["tile_n", "sp", [-1, 1, 1, 1]], ["tile_f", "sp", [-1, 1, 8, 1]], ["tile_y", "sp", [-1, 1, 1, 1]], ["tile_x", "sp", [-1, 1, 1, 7]], ["fuse_yx", "ot", 0], ["tile_rc", "sp", [-1, 1]], ["tile_ry", "sp", [-1, 3]], ["tile_rx", "sp", [-1, 3]], ["reorder_inner", "re", [2, 0, 1]], ["AA_double_buffer", "ot", 0], ["WW_double_buffer", "ot", 0], ["auto_unroll_max_step", "ot", 0]]}, "result": [[0.00016344830202702702], 0, 1.9673919677734375, 1615490846.806043], "version": 0.2, "tvm_version": "0.7.dev1"}
{"input": ["cuda -keys=cuda,gpu -max_num_threads=1024 -thread_warp_size=32", "conv2d_NCHWc_int8.cuda", [["TENSOR", [1, 256, 14, 14], "int8"], ["TENSOR", [512, 256, 3, 3], "int8"], [2, 2], [1, 1, 1, 1], [1, 1], "NCHW", "int32"], {}], "config": {"index": 297141, "code_hash": null, "entity": [["tile_n", "sp", [-1, 1, 1, 1]], ["tile_f", "sp", [-1, 1, 8, 1]], ["tile_y", "sp", [-1, 1, 1, 1]], ["tile_x", "sp", [-1, 1, 1, 7]], ["fuse_yx", "ot", 0], ["tile_rc", "sp", [-1, 1]], ["tile_ry", "sp", [-1, 3]], ["tile_rx", "sp", [-1, 3]], ["reorder_inner", "re", [1, 0, 2]], ["AA_double_buffer", "ot", 0], ["WW_double_buffer", "ot", 0], ["auto_unroll_max_step", "ot", 0]]}, "result": [[0.00016632746354883083], 0, 2.497293710708618, 1615490848.2900608], "version": 0.2, "tvm_version": "0.7.dev1"}
{"input": ["cuda -keys=cuda,gpu -max_num_threads=1024 -thread_warp_size=32", "conv2d_NCHWc_int8.cuda", [["TENSOR", [1, 256, 14, 14], "int8"], ["TENSOR", [512, 256, 3, 3], "int8"], [2, 2], [1, 1, 1, 1], [1, 1], "NCHW", "int32"], {}], "config": {"index": 1802421, "code_hash": null, "entity": [["tile_n", "sp", [-1, 1, 1, 1]], ["tile_f", "sp", [-1, 1, 8, 1]], ["tile_y", "sp", [-1, 1, 1, 1]], ["tile_x", "sp", [-1, 1, 1, 7]], ["fuse_yx", "ot", 0], ["tile_rc", "sp", [-1, 1]], ["tile_ry", "sp", [-1, 3]], ["tile_rx", "sp", [-1, 3]], ["reorder_inner", "re", [2, 0, 1]], ["AA_double_buffer", "ot", 0], ["WW_double_buffer", "ot", 1], ["auto_unroll_max_step", "ot", 0]]}, "result": [[0.00016312203573836816], 0, 2.2550745010375977, 1615490849.7992082], "version": 0.2, "tvm_version": "0.7.dev1"}
{"input": ["cuda -keys=cuda,gpu -max_num_threads=1024 -thread_warp_size=32", "conv2d_NCHWc_int8.cuda", [["TENSOR", [1, 256, 14, 14], "int8"], ["TENSOR", [512, 256, 3, 3], "int8"], [2, 2], [1, 1, 1, 1], [1, 1], "NCHW", "int32"], {}], "config": {"index": 277946, "code_hash": null, "entity": [["tile_n", "sp", [-1, 1, 1, 1]], ["tile_f", "sp", [-1, 1, 16, 1]], ["tile_y", "sp", [-1, 1, 1, 1]], ["tile_x", "sp", [-1, 1, 1, 7]], ["fuse_yx", "ot", 0], ["tile_rc", "sp", [-1, 4]], ["tile_ry", "sp", [-1, 1]], ["tile_rx", "sp", [-1, 3]], ["reorder_inner", "re", [1, 0, 2]], ["AA_double_buffer", "ot", 0], ["WW_double_buffer", "ot", 0], ["auto_unroll_max_step", "ot", 0]]}, "result": [[0.0001651998674863388], 0, 2.3707568645477295, 1615490851.292946], "version": 0.2, "tvm_version": "0.7.dev1"}
{"input": ["cuda -keys=cuda,gpu -max_num_threads=1024 -thread_warp_size=32", "conv2d_NCHWc_int8.cuda", [["TENSOR", [1, 256, 14, 14], "int8"], ["TENSOR", [512, 256, 3, 3], "int8"], [2, 2], [1, 1, 1, 1], [1, 1], "NCHW", "int32"], {}], "config": {"index": 1568186, "code_hash": null, "entity": [["tile_n", "sp", [-1, 1, 1, 1]], ["tile_f", "sp", [-1, 1, 16, 1]], ["tile_y", "sp", [-1, 1, 1, 1]], ["tile_x", "sp", [-1, 1, 1, 7]], ["fuse_yx", "ot", 0], ["tile_rc", "sp", [-1, 4]], ["tile_ry", "sp", [-1, 1]], ["tile_rx", "sp", [-1, 3]], ["reorder_inner", "re", [1, 0, 2]], ["AA_double_buffer", "ot", 0], ["WW_double_buffer", "ot", 1], ["auto_unroll_max_step", "ot", 0]]}, "result": [[0.00016281306989247312], 0, 2.3871004581451416, 1615490852.817816], "version": 0.2, "tvm_version": "0.7.dev1"}
{"input": ["cuda -keys=cuda,gpu -max_num_threads=1024 -thread_warp_size=32", "conv2d_NCHWc_int8.cuda", [["TENSOR", [1, 256, 14, 14], "int8"], ["TENSOR", [512, 256, 3, 3], "int8"], [2, 2], [1, 1, 1, 1], [1, 1], "NCHW", "int32"], {}], "config": {"index": 1775535, "code_hash": null, "entity": [["tile_n", "sp", [-1, 1, 1, 1]], ["tile_f", "sp", [-1, 1, 4, 1]], ["tile_y", "sp", [-1, 1, 1, 1]], ["tile_x", "sp", [-1, 1, 1, 7]], ["fuse_yx", "ot", 0], ["tile_rc", "sp", [-1, 1]], ["tile_ry", "sp", [-1, 1]], ["tile_rx", "sp", [-1, 3]], ["reorder_inner", "re", [2, 0, 1]], ["AA_double_buffer", "ot", 0], ["WW_double_buffer", "ot", 1], ["auto_unroll_max_step", "ot", 0]]}, "result": [[0.00016392486354378818], 0, 2.192277431488037, 1615490854.3015473], "version": 0.2, "tvm_version": "0.7.dev1"}
{"input": ["cuda -keys=cuda,gpu -max_num_threads=1024 -thread_warp_size=32", "conv2d_NCHWc_int8.cuda", [["TENSOR", [1, 256, 14, 14], "int8"], ["TENSOR", [512, 256, 3, 3], "int8"], [2, 2], [1, 1, 1, 1], [1, 1], "NCHW", "int32"], {}], "config": {"index": 485295, "code_hash": null, "entity": [["tile_n", "sp", [-1, 1, 1, 1]], ["tile_f", "sp", [-1, 1, 4, 1]], ["tile_y", "sp", [-1, 1, 1, 1]], ["tile_x", "sp", [-1, 1, 1, 7]], ["fuse_yx", "ot", 0], ["tile_rc", "sp", [-1, 1]], ["tile_ry", "sp", [-1, 1]], ["tile_rx", "sp", [-1, 3]], ["reorder_inner", "re", [2, 0, 1]], ["AA_double_buffer", "ot", 0], ["WW_double_buffer", "ot", 0], ["auto_unroll_max_step", "ot", 0]]}, "result": [[0.00016791564033264033], 0, 2.29756760597229, 1615490855.7820017], "version": 0.2, "tvm_version": "0.7.dev1"}
{"input": ["cuda -keys=cuda,gpu -max_num_threads=1024 -thread_warp_size=32", "conv2d_NCHWc_int8.cuda", [["TENSOR", [1, 256, 14, 14], "int8"], ["TENSOR", [512, 256, 3, 3], "int8"], [2, 2], [1, 1, 1, 1], [1, 1], "NCHW", "int32"], {}], "config": {"index": 166576, "code_hash": null, "entity": [["tile_n", "sp", [-1, 1, 1, 1]], ["tile_f", "sp", [-1, 2, 4, 1]], ["tile_y", "sp", [-1, 1, 1, 1]], ["tile_x", "sp", [-1, 1, 1, 7]], ["fuse_yx", "ot", 0], ["tile_rc", "sp", [-1, 2]], ["tile_ry", "sp", [-1, 1]], ["tile_rx", "sp", [-1, 3]], ["reorder_inner", "re", [0, 2, 1]], ["AA_double_buffer", "ot", 0], ["WW_double_buffer", "ot", 0], ["auto_unroll_max_step", "ot", 0]]}, "result": [[0.00019295725896414343], 0, 2.4559695720672607, 1615490857.383124], "version": 0.2, "tvm_version": "0.7.dev1"}
{"input": ["cuda -keys=cuda,gpu -max_num_threads=1024 -thread_warp_size=32", "conv2d_NCHWc_int8.cuda", [["TENSOR", [1, 256, 14, 14], "int8"], ["TENSOR", [512, 256, 3, 3], "int8"], [2, 2], [1, 1, 1, 1], [1, 1], "NCHW", "int32"], {}], "config": {"index": 166586, "code_hash": null, "entity": [["tile_n", "sp", [-1, 1, 1, 1]], ["tile_f", "sp", [-1, 1, 16, 1]], ["tile_y", "sp", [-1, 1, 1, 1]], ["tile_x", "sp", [-1, 1, 1, 7]], ["fuse_yx", "ot", 0], ["tile_rc", "sp", [-1, 2]], ["tile_ry", "sp", [-1, 1]], ["tile_rx", "sp", [-1, 3]], ["reorder_inner", "re", [0, 2, 1]], ["AA_double_buffer", "ot", 0], ["WW_double_buffer", "ot", 0], ["auto_unroll_max_step", "ot", 0]]}, "result": [[0.00016901874353598883], 0, 2.2438671588897705, 1615490858.8611612], "version": 0.2, "tvm_version": "0.7.dev1"}
